journal,text
hal,"Increase in rice productivity in the Senegal River valley due to improved collective management of irrigation schemes .

Village irrigation schemes cover about 25% of the irrigated area on the two banks of the Senegal River. We analyzed irrigation scheme and rice crop management practices during the 1998 wet season in this type of irrigation scheme in Mauritania. Average yield was 4.8 t ha-1; problems with irrigation rules resulted in great variability of irrigation frequency between fields, and sub-optimal timing of nitrogen fertilizer application resulted in yield losses. Based on this diagnosis, we suggested to farmers new irrigation rules and cropping calendars planned on the scale of the irrigation scheme. Planned cropping calendars were built using CalCul, a software that we designed on the basis of the irrigated rice development model RIDEV. These suggestions of improved collective management were implemented in the 1999 and 2000 wet seasons. Average yield reached 7.2 t ha-1 in 1999 and 8.2 t ha-1 in 2000, without any significant increase in production costs. This great increase in rice productivity was mainly due to better collective management obtained through planning cropping calendars. This result showed that technical innovation is not the only way to improve productivity. irrigated rice / West Africa / crop management / input efficiency / decision support tool
irrigated rice / West Africa / crop management / input efficiency / decision support tool
1. Introduction
irrigation schemes in the Senegal River Valley cover about 50 000 ha (Saed, 1997; Sonader, 1998). During the 1998 wet season, about 75% of this area was used, i.e. 20 000 ha in Senegal and 18 000 ha in Mauritania, almost exclusively for rice (Oryza sativa L.). Potential rice grain yields (limited by solar radiation and temperature only) are on average about 9 t ha-1 in the wet growing season from July to November (Dingkuhn and Sow, 1997) while actual average farmer yields are about 5 t ha-1 (SAED, 1997; SONADER, 1998). Agronomic studies (Le Gal, 1997; Wopereis et al., 1999; Haefele et al., 2001; Poussin et al., 2003) identified sub-optimal timing of crop management interventions (i.e. date of sowing or transplanting, herbicide and fertilizer applications, and harvest and post-harvest activities) as major constraints.

The structural adjustment programs of the 1990s have put the responsibility for management of irrigation schemes in Senegal and Mauritania mostly back into farmers' hands. Decisionmaking on irrigation schedules, land preparation, purchase of inputs (fertilizers and herbicides), harvesting and marketing of
the product is done collectively on the scale of the irrigation scheme. Financing of production costs requires credit obtained through collective loans, paid back after harvest. Moreover, previous loans have to be reimbursed to obtain a new one. Decision-making at the field level by individual farmers is, therefore, strongly influenced by decisions taken collectively at the irrigation scheme level (Poussin, 1995; Le Gal and Papy, 1998). Moreover, improving the productivity for individual farmers in the collective irrigation scheme is not sustainable.

To improve rice productivity, best-bet cropping calendars need, therefore, to be determined collectively at both scheme and field levels. We hypothesize that planning crop calendars on the scale of the irrigation scheme before the beginning of the crop season can improve input efficiency and rice productivity without any technical innovation.

The objectives of this study were to (i) investigate determinants of rice yield in a village irrigated scheme of the Senegal River valley; (ii) develop and evaluate a decision-support tool for improved cropping calendars at the irrigation scheme level; (iii) analyze the effects of changes in collective decision-making on rice yields and profitability.
* Corresponding author: poussin@ird.fr
Article published by EDP Sciences and available at http://www.edpsciences.org/agro or http://dx.doi.org/10.1051/agro:2005021
2. Materials and methods
2.1. Site description
Studies were implemented in the village irrigation scheme of Nakhlet, a small village on the northern bank of the Senegal River, 60 km east of Rosso (16degrees 29' N, 15degrees 12' W) in Mauritania. This type of irrigation scheme (or perimeter), with an area of below 50 ha and cultivated by farmers from a single village, covers about 25% of the irrigated area on the two banks of the Senegal River (SAED, 1997; SONADER, 1998).

The perimeter of Nakhlet was built in 1981 for the Mauritanian irrigation and extension authority, the ``Societe Nationale de Developpement Rural'' (SONADER). It covers 27.5 ha, with 119 fields cultivated by 29 farmers. Irrigation is carried out through pumping from a tributary of the Senegal River. Irrigated rice is cultivated only during the wet season, from midJune to the end of November. Crop establishment in all fields is realized using a disk plow and direct sowing of pre-germinated seed. In 1998, 1999 and 2000, farmers used three indica cultivars with slender grain: Sahel 108 (IR13240-108-2-2-3, short duration), Jaya (medium duration) and Sahel 202 (ITA 306, medium duration). The potential yields of these three cultivars are similar and are on average about 8 to 9 t ha-1 in the wet season (Dingkuhn and Sow, 1997; WARDA, 1999).

After about 10 years under semi-public management, the Nakhlet farmers' organization took over the perimeter management from 1992. The farmers' organization manages credit provision, water pumping and irrigation, input supply (i.e. herbicides, fertilizers, fuel, etc.), and land preparation. Field irrigation is done by farmers on a rotational basis. This functioning is typical of the village irrigation schemes on the two banks of the Senegal River (Diemer and van der Laan, 1987).
2.2. Agronomic, hydraulic and economic survey
All 119 fields in the Nakhlet perimeter were monitored during the wet seasons of 1998, 1999 and 2000 (1998WS, 1999WS, 2000WS). The survey carried out in the 1998WS was used to determine the initial situation in terms of crop and water management, and sources of yield gap and variability. The topsoil (0 to 0.2 m depth) from all fields was sampled in 1998 before the onset of the growing season (one composite sample from 4 samples taken at random per field). Soil analyses (clay content, C and N content, P-Olsen, pH, electrical conductivity, CEC and exchangeable K) were conducted in the IRD laboratory in Dakar, Senegal, following standard methodologies.

The cultivars sown, type of seed (certified or retained from previous harvest), types and rates of applied fertilizers, type of weed control (manual or chemical) and rates of applied herbicides were recorded for each field. The dates of each management intervention (i.e. land preparation, irrigation, sowing, weed control, fertilizer applications and harvesting) were also recorded. Moreover, visual scores of weed infestation were taken at panicle initation in each field. Four scores, corresponding to four classes of surface area coverage by weeds, were distinguished: 0 for none; 1 for weak (less than 10% of surface area coverage by weeds); 2 for strong (between 10 and 30%); 3 for
very strong (more than 30% of surface area coverage by weeds). Poussin et al. (2003) showed that a weed surface cover of less than 10% at panicle initation corresponded to a dry weed biomass of between 0 and 24 g m-2, a surface cover between 10 and 30% corresponded to a weed biomass of between 13 and 228 g m-2, and a cover of more than 30% corresponded to a biomass greater than 130 g m-2. Grain yield (corrected for 14% moisture) was determined at maturity in the center of each field using a sampling area of 25 m2. Grain rice yield of the whole field can be slightly overestimated, but comparisons between years at the perimeter level are still relevant.

The volume of water pumped into the Nakhlet perimeter in 1998 and 1999 was monitored daily during the wet season. The discharge measurement at the head of the perimeter was ensured through a rectangular weir installed at the outflow point of the stilling basin of the pump. The characteristics of this flume (length, width and discharge coefficient) enabled the calculation, using the Manning-Strickler formula, of the discharge according to the water level upstream of the flume, measured through a gauge placed inside the stilling basin (Bos et al., 1991): Q = Cd.b.(2.g)0,5.H1,5. Where Q is the discharge (in m3 s-1), b the breadth of the control section (m), Cd the discharge coefficient, g the gravitational acceleration (m s2) and H the upstream head above the crest (m). A counter was installed on the pump to measure the operational hours. Irrigation water volume was estimated to be 70% of pumped inflow to allow for conveyance losses (Tuzet and Perrier, 1998). We further assumed that irrigation water was distributed homogeneously in the irrigated fields. No measurements were conducted during the 2000 wet season, as similar water allocation rules were applied to those in 1999.

Farmers financed their production costs through bank loans obtained by the farmers' organization. The Nakhlet farmers' organization purchased inputs and provided farmers with certified seeds, fertilizers and herbicides, according to the area of their fields. After harvest, farmers reimbursed the farmers' organization in rice paddy, which was sold by the farmers' organization to pay back the bank. Rice paddy is sold to the state, which guarantees a paddy price of between 38 and 45 Uguiya (Mauritanian currency [UM]) per kg (1 UM = 0.0032 Euro as of March 2004), depending on milling recovery (SONADER, 1998). A financial survey was conducted at the perimeter level during the 1998, 1999 and 2000 wet seasons. Production costs were calculated for each individual field. Irrigation costs included fuel, engine oil, maintenance and pump attendant salary. Cropping costs included land preparation, use of certified seeds, and purchase of fertilizers and herbicides. Their costs corresponded to suppliers' and providers' invoices. Costs of seeds retained from the previous harvest were estimated as 45 UM kg-1. Harvest was done manually by each farmer in the 1998 and 1999 wet seasons and by a combine harvester through a service provider in the 2000WS. Comparison between years was made excluding harvest costs. Organizational changes in 1999 and 2000 did not modify the amount of work done by the farmers. Comparison between years was made excluding labor costs. The gross product of the perimeter corresponded to the total rice paddy production value. The average paddy selling price was 42 UM kg-1.

2.3. Use of models for diagnosis: evapotranspiration, potential yield and development of irrigated rice .

Daily rainfall during the 1998, 1999 and 2000 wet seasons was measured in Nakhlet using a pluviometer. Reference evapotranspiration was calculated using the Penman-Monteith equation (Smith et al., 1992; Allen et al., 1998) and weather data recorded at the experimental station of WARDA (West African Rice Development Association) in Fanaye (16degrees 33' N, 15degrees 46' W), near Nakhlet, on the Senegalese bank. The evapotranspiration of rice is calculated by multiplying the reference evapotranspiration with a varying crop factor (kc). The set of kc-values given by FAO (1986) and Siddeek et al. (1988) are used: kc being 1.15 during the vegetative growth phase, 1.3 during the reproductive phase, and 1.05 after the first week of maturation. Cumulative potential evapotranspiration of rice during the crop season was compared with the total of irrigation water supply and rainfall.

The rice growth model ORYZAS (Dingkuhn and Sow, 1997) simulates energy-limited and temperature-limited potential rice yield in the Sahel using daily minimum and maximum temperatures, solar radiation and geographical latitude (to calculate photoperiod). This model was used to calculate potential yields in the 1998WS, 1999WS and 2000WS using climatic data recorded in Fanaye.

The rice phenology model RIDEV (Dingkuhn et al., 1995) simulates irrigated rice development in the Sahel and provides crop management recommendations based on crop phenology at the field level. For a cultivar, a sowing date and a planting method (direct sowing or transplanting), RIDEV provides (i) the percentage of spikelet sterility due to cold or heat during flowering; (ii) dates of critical stages in rice development (flowering and maturity), and (iii) optimal timing for transplanting, weeding, fertilizer application, last drainage before harvest and harvest. Input data are geographical latitude of the site, daily minimum and maximum temperatures, and photothermal characteristics of the rice cultivar (Dingkuhn and Miezan, 1995). This model was used to reconstruct the rice development and to determine spikelet sterility percentage in each field during the wet seasons of 1998, 1999 and 2000 using daily temperatures recorded in Fanaye. RIDEV was also used to evaluate differences between optimal and actual cropping calendars in each field.
2.4. Planning cropping calendars at the perimeter level
RIDEV was used to develop CalCul (``Calendrier Cultural''), a software package written in the C language for the Microsoft Disk Operating System, that provides an optimal cropping calendar for irrigated rice on the scale of irrigation schemes in the Sahel (Poussin, 2000). This cropping calendar takes into account the organization of collective operations (i.e. operations that are collectively managed): mechanized land preparation, flooding before land preparation (pre-flooding) or before sowing (flooding), transplanting and mechanized harvest (manual harvest is often carried out individually, but mechanized harvest is carried out collectively). Input data are: (i) planned date for the start of the sowing period; (ii) rice cultivar sown; (iii) planting method (assumed to be common to all fields); (iv) duration of each collective operation for the whole
perimeter, i.e. land preparation, flooding and pre-flooding (assumed to last the same time), transplanting (if this is the planting method chosen) and harvest. Moreover, in the case of pre-flooding, the average duration of soil drainage is needed.

To prevent leakage, flooding and land preparation are usually not performed at the same time; fields are usually flooded just before sowing or transplanting and this first flooding can last 2 days for each field. The optimal timing of transplanting, fertilizer top-dressed applications and harvest are based on rice phenology. To obtain an optimal cropping calendar in each field, operations (sowing, transplanting, fertilizer top-dressed applications and harvest) should have the same duration at the perimeter level. Without a common duration (for example, sowing nursery lasts 2 days and transplanting lasts 15 days on the scale of the perimeter), timing will be sub-optimal in some fields. The slowest collective operation set is therefore the common duration of all the cultural interventions, particularly sowing.

Farmers often choose their rice cultivar individually (Poussin, 1995) and direct sowing and transplanting can coexist in the same irrigation scheme (Poussin, 1997). Nevertheless, they can agree to choose one or two common cultivars, or cultivars with similar duration. The cultivar with the shortest duration would then be sown at the end of the sowing period to minimize the total crop duration on the scale of the perimeter. Direct sowing and transplanting lead to different crop development duration for the same cultivar. In the case of both planting methods, two cropping calendars at the perimeter level should be made.

CalCul uses the phenology model RIDEV (Dingkuhn et al., 1995) to simulate rice development for the first cultivar sown at the beginning of the sowing period (S1), and for the second cultivar sown at the end of the sowing period (S2). The duration of the sowing period is the duration of the slowest collective operation. These 2 simulations (S1 and S2) are made using historical weather data recorded near the site. Each simulation provides average and extremes of dates for several stages (Fig. 1): start of tillering, panicle initiation, heading, flowering and maturity. Spikelet sterility percentages (average and maximum) for S1 and S2 are also calculated.

At the perimeter level, the timing of each stage will be an average between the mean of dates for S1 and S2, and could start at the earliest at the minimum date for S1 and could end at the latest at the maximum date for S2. The starting and end dates (averages and extremes) of crop management interventions (weed management, fertilizer applications, last drainage and harvest) are based on rice phenology. The first flooding can last 2 days for each field and ends the day before sowing (or transplanting); land preparation ends just before flooding starts (it can end at the latest the day before the end of flooding); preflooding starts according to the duration of soil drainage.

The weeding and fertilizer management suggested by CalCul complies with WARDA recommendations (Wopereis et al., 2001). The first weeding can be done chemically with preemergence or post-emergence herbicides, and a second weeding can be done manually before the second N top dressing. Nitrogen fertilizer supply is suggested to be split into 2 or 3 topdressed applications at the start of tillering, panicle initation and possibly heading. P and K fertilizer management is not specified. Contrary to SONADER and SAED (``Societe d'Amenagement
et d'Exploitation des terres du Delta et de la vallee du Senegal'', Senegalese irrigation and extension authority) recommendations, farmers generally merge P fertilizer with the first N topdressed application (Wopereis et al., 1999; Poussin et al., 2003). Basal application of K fertilizer before land preparation depends on soil exchangeable K status (Haefele et al., 2001). Cropping calendars for each field should follow the cropping calendar built on the scale of the perimeter. The realization of
each operation in the fields should follow the water allocation cycle.

CalCul software was used to make the planned cropping calendars of the 1999 and 2000 wet seasons. Simulation calendars were made taking into account technical choices made by farmers (cultivar, sowing period, planting method and use of preflooding) and using historical weather data recorded in Rosso between 1970 and 1984.
2.5. Technical organization changes
Surveys during the 1998WS showed great variability in irrigation frequency between fields, and sub-optimal timing of nitrogen fertilizer application resulted in rice yield losses (see details in results and discussion). This diagnosis of the 1998WS was explained and discussed with farmers during a general meeting in Nakhlet in April 1999. Farmers were invited to implement several changes in their technical organization. These changes were meant to (i) reduce the variability in irrigation frequency between fields and (ii) reduce the gap between optimal and actual cropping calendars.

Thus, it was suggested to continue the water allocation cycle after rain (i.e. water allocation is not re-initialized and re-starts after rain in the next fields). In order to install an information system on field irrigation, a map of the perimeter (based on a cadastral survey; all the farmers could identify their own fields on this map) was posted showing weekly which fields had to be irrigated (based on the irrigation schedule). The farmer who was in charge of field irrigation had to notify on this map which fields were irrigated in order to inform the other farmers (field irrigation is done by farmers on a rotational basis). It was also suggested they should plan cropping calendars at the perimeter level for the next wet season and post a map of the perimeter (based on a cadastral survey) showing weekly which operation had to be done and which field had to be treated (based on the planned cropping calendars and water allocation cycle). Agricultural advisors of SONADER, that were present at the general meeting, also suggested in the 1999WS pre-flooding one month before land preparation in order to reduce early weed infestation, and using certified seed of Sahel 202 in the 2000WS. Farmers accepted these suggestions. They chose furthermore to grow only one cultivar (Jaya in the 1999WS and Sahel 202 in the 2000WS) and to delay the sowing period to make sure harvest would be after the rainy period.

Planned cropping calendars were built for the 1999 and 2000WS using CalCul (Fig. 1). Flooding was the slowest collective operation and set the common duration of crop management interventions on the scale of perimeter. After this planning, there was no interference in farmers' practices during the cropping season. The surveys made in the 1999WS and 2000WS were compared with the 1998WS to evaluate the effects of these changes on yields and profitability.
3. Results and discussion
3.1. Diagnosis of the 1998 wet season
In the 1998WS, farmers sowed Jaya between 20 June and 1 July (Tab. I) on 15.5 ha (65 fields) and Sahel 108 on 12.5 ha (54 fields). Sahel 108 was cultivated in Nakhlet for the first time that year. Sahel 108 seeds were certified; Jaya seeds were retained from the previous harvest. Harvest occurred from 4 to 7 November, an average of 135 days after sowing for Jaya and 129 days after sowing for Sahel 108. All fields were manually harvested. Maturity dates simulated with the model RIDEV for each field were an average of 118 days after sowing for Jaya and 109 days after sowing for Sahel 108. The average harvest
delay was, therefore, 17 days for Jaya and 20 days for Sahel 108.

RIDEV simulations indicated no problems with spikelet sterility in any field (i.e. simulated spikelet sterility ratio < 5%) and average of potential yield calculated with the model ORYZAS was 8.7 t ha-1 for Jaya and 8.2 t ha-1 for Sahel 108. Rice grain yield measured at maturity ranged from 2.7 t ha-1 to 7.1 t ha-1, with an average of 4.8 t ha-1. Low yields were mainly localized in the fields far away from the irrigation source. The average yield for Jaya (5.5 t ha-1) was significantly higher (Student's test, P < 0.0001) than for Sahel 108 (4.0 t ha-1). Farmers wanted therefore to understand the origins of yield variability and the clear differences between cultivars.
3.1.1. Soil variability
The results of soil analyses corresponded well with soil characteristics in irrigated schemes of the Senegal River valley described by Haefele et al. (2001). Topsoil clay content varied with distance from the bank, ranging from about 35% to 55%. C content ranged from 4.4 to 7.9 g mg kg-1 soil, with an average of 6.2 g kg-1, and N content ranged from 0.37 to 0.71 g kg-1 soil, with an average of 0.52 g kg-1. CEC varied from 18 to 29 cmol kg-1 and was well correlated with clay content (r2 = 0.823). Exchangeable K ranged from 0.4 to 0.9 cmol kg-1 soil, with an average of 0.7 cmol kg-1. P-Olsen ranged from 4.3 to 17 mg kg-1 soil, with an average of 10.2 mg kg-1. P and K availabilities are above the critical levels for rice (Dobermann et al., 1995; Sanchez, 1976). Electrical conductivity ranged from 0.4 to 1.5 mS cm-1 with an average of 0.9 mS cm-1, and pH ranged from 5.8 to 6.5 with an average of 6.1, which do not constitute constraints for irrigated rice cropping when irrigation is well managed (Asch and Wopereis, 2000). We assumed, therefore, that initial soil P and K status, and soil salinity levels when irrigation is well managed, were not hampering rice growth.
3.1.2. Irrigation management
Irrigation started on 19 June 1998 with flooding before direct sowing and ended on 30 September 1998. The total pumped water volume was 265 700 m3, including 79 000 m3 for flooding (Tab. ii). The average irrigation water supply in the fields was estimated at 756 mm and rainfall was 207 mm, whereas evapotranspiration of the rice was estimated at 802 mm. The total of irrigation water supply and rainfall was about 160 mm above the evapotranspiration of the rice, but water losses through percolation could be estimated at about 2 mm per day (i.e. more than 200 mm from sowing to maturity) for this type of soil (Raes et al., 1997).

Fields were irrigated 4 to 9 times after flooding. Estimated irrigation water supply (flooding included) ranged from 528 mm to 828 mm as a function of irrigation frequency (Tab. iii). Irrigation frequency and irrigation water supply were lower in the fields relatively far away from the irrigation source, that were mostly sown with Sahel 108. Water allocation rules based on re-initializing the water allocation cycle after rain contributed to this irrigation frequency heterogeneity (water allocation cycle started in the fields near to the irrigation source). Effects of irrigation frequency (through irrigation water supply and risk of water shortage) on rice yield during the 1998WS were strongly significant (Student's test, P < 0.0001). Fields irrigated
less than 7 times after flooding were mainly sown with Sahel 108 (Tab. III); the irrigation water supply was below 700 mm and the average yield was 4.2 t ha-1. Fields irrigated at least 7 times after flooding were mainly sown with Jaya; the irrigation water supply was above 700 mm and the average yield was 5.3 t ha-1. This could explain the yield gap between Jaya and Sahel 108. Nevertheless, the average of yield obtained with Jaya was still significantly higher in the fields irrigated 6 to 7 times after flooding, where both cultivars were sown (see Tab. iii).
3.1.3. Weeding and fertilizer management
