journal,text
The first axis (S1) of the PCA1 explained 80% of the variability observed (Table 4), indicating a strong correlation between plant density, tiller density and above-ground biomass at PI. S1 measures plant stand and growth at PI. Table 5 shows the effect of weed infestation at PI combined with N management (first application) on the S1 factor loadings. In the direct-seeded plots, management of the first N application had a significant effect on the S1 factor loadings (P B/ 0.01). Negative factor loadings were found if recommendations on the first N application were not followed, and positive factor loadings if the recommendations were followed. For transplanted plots, management of the first N application did not have a significant effect on S1 factor loadings. For both direct-seeded and transplanted microplots, good weed management (weed cover B/ 10%) combined with a first N application following recommendations resulted in the highest average S1 factor loading. The S1 factor loadings for the transplanted micro-plots were significantly lower than those of direct-seeded micro-plots (P B/0.001). Positive S1 factor loadings were only
table 4 results of the twice principal component analyses Pca1 and Pca2
Pca1 Variability Factorial scores
total 3 PLD TD AB Axis 1 2.40 (80.0%) 0.890 0.896 0.898
PCA2 Variability Factorial scores
total 5 PAD SW SD FSP W1G Grain yield Axis 1 2.33 (46.6%) 0.859 0.885 0.898 0.031 /0.047 0.859 Axis 2 1.25 (24.9%) /0.152 0.107 0.027 /0.789 /0.768 /0.222
Explained variability of the first factorial axis in PCA1 and factor loadings for the 3 variables plant density (PLD), tiller density (TD) and above-ground biomass (AB). Explained variability of the first two factorial axis in PCA2 and factor loadings for the 5 variables panicle density (PAD), straw weight (SW), spikelet density (SD), filled spikelet percentage (FSP) and single grain weight (W1G), and for the grain yield as supplementary variable in PCA2.

J.C. Poussin et al. / Europ. J. Agronomy 19 (2003) 341 /356350
obtained in fields with a transplanting density of
/20 hills m 2 in the wet season and /40
hills m 2 in the dry season (Fig. 4).

The first two axes of the PCA2 explained 72% of total variance (Table 4). The first axis, explaining 47% of total variability, illustrates the strong correlation between panicle density, straw weight and spikelet density. This axis reflected plant density and yield potential at maturity. The second
axis explained about 25% of variability, representing essentially the variability in filled spikelet
percentage and single grain weight. Yield (transformed data, i.e. margins after removing the
effects of year, variety and season on the averages)
was very well represented on the first axis. Table 6 shows that in both direct-seeded and transplanted
micro-plots, management of the second N application and the level of weed infestation had a significant effect (P B/0.001) on factor loadings
of the first factorial axis of PCA2 (S2). S2 factor
loadings for direct-seeded micro-plots were on average not significantly higher than for transplanted micro-plots (Table 6).

Differences in yield components (margins after removing the effects of year, variety and season on
the averages) between direct-seeded and transplanted plots were quite substantial although yields were similar (Table 7). Transplanted plots
had higher spikelet density than direct-seeded
plots, compensated with slightly lower single grain weight; they had also lower panicle density compensated with higher number of spikelets per
panicle than direct-seeded plots. This lower panicle
Table 5 Factor loadings (first factorial axis) for PCA1 for direct-seeded and transplanted micro-plots
Direct-seeded plots
First N application Number of plots S1 average S.D. Weed infestation Number of plots S1 average S.D.

Recommendations followed 32 /1.07** 1.68 B/10% area 12 /1.56 (a) 2.05
/10% area 20 /0.78 (ab) 1.33
Recommendations not followed 18 /0.33** 1.11 B/10% area 5 /0.40 (ab) 0.95
/10% area 13 /0.30 (b) 1.16
All plots 50 /0.58*** 1.64
Transplanted plots First N application Number of plots S1 average S.D. Weed infestation Number of plots S1 average S.D. Recommendations followed 7 /0.14 (ns) 0.69 B/10% area 7 /0.14 (ns) 0.69
/10% area 0
Recommendations not followed 30 /0.33 (ns) 1.11 B/10% area 19 /0.69 (ns) 1.10
/10% area 11 /1.30 (ns) 1.16
All plots 37 /0.77*** 0.99
Micro-plots are classified according to weed infestation levels (B/10% area infested by weeds, and /10% area infested by weeds), and according to management of the first N application (recommendations followed or not); (ns): non significant; multiple comparisons with Scheffe's test: **significant with P B/0.05 between (a) and (b), ***non significant between (ab) and (a) or (b).

J.C. Poussin et al. / Europ. J. Agronomy 19 (2003) 341 /356 351
J .C . P o u ssin et a l. / E u ro p . J . A g ro n o m y 1 9 ( 2 0 0 3 ) 3 4 1 /3 5 6 3 5 2
density is illustrated by the lower S1 factor loadings at PI. Low S1 factor loadings lead to low S2 factor loadings apart from the wellmanaged plots (weed infestation at maturity B/ 10% area and second N application following recommendation) as shown in Fig. 5.

Well-managed plots in terms of fertilizer and weed management resulted in substantially higher grain yields (increase on average of 2.8 t ha 1, see Table 7). This yield increase in both direct and
transplanted plots was entirely due to an increase in spikelet density linked with an increase in panicle density and/or number of spikelet per panicle. Our results agree well with observations by Haefele et al. (2000) who reported an increase of 2 t ha 1 through improved soil fertility and weed management.

4. Conclusions .

Soil and weather variability had a relatively minor effect on rice yield variability in farmers' fields. Simulation analysis showed that farmers used sowing dates within the window recommended for wet and dry seasons, avoiding spikelet sterility due to cold or heat stress around flowering. Harvest dates were also close to physiological maturity of the rice crop. Yield variability was, therefore, mostly due to differences in crop management (other than choice of sowing and harvest dates) at the farmer level. However, cold temperatures at the onset of the dry season reduced crop growth and increased within-field tiller density variability. Direct seeding resulted in relatively high but strongly variable plant density and more vigorous growth in the vegetative phase than with transplanting. Low transplanting density and the use of relatively old seedlings seriously affected plant and tiller densities at PI, as illustrated by the low S1
Table 7 Yield component differences for direct-seeded (DS) and transplanted (TP) micro-plots and for well-managed (A) and poorly managed plots (B) as far as weed and N fertilizer management is concerned
Averages DS (margins) TP (margins) (DS /TP) A (margins) B (margins) (A /B)
DP (no. M 2) 395.2 /22.1 /29.9 /52.0* /70.8 /25.4 95.3*** NS/P (No) 87.6 /9.6 /13.0 /22.6*** /18.7 /6.7 25.5*** DS (no. m 2) 33576 /2835 /3830 /6665** /13348 /4497 18145*** FSP (%) 77.27 /0.11 /0.15 0.26 (ns) /0.44 /0.16 0.59 (ns) W1G (mg) 21.04 /0.19 /0.26 0.46** /0.20 /0.07 /0.27 (ns) Y (g m 2) 546.7 /29.1 /39.3 /68.3 (ns) /206.1 /74.0 280.1***
(A): average value (margins) for micro-plots with B/10% weed cover and where farmers followed recommendations for the second N application; (B): average value (margins) for micro-plots with /10% weed cover and where farmers did not follow recommendations for the second N application; (ns): non significant; multiple comparisons with Scheffe's test: **significant with P B/0.05 between (a) and (b), ***non significant between (ab) and (a) or (b).

Fig. 5. Relation between S1 and S2 factor loadings (first factorial axes on PCA1 and PCA2) for well-managed (weed cover B/10% and second N fertilization followed recommendation) and poorly managed (weed cover /10% and second N fertilization not followed recommendation) direct-seeded and transplanted plots.

J.C. Poussin et al. / Europ. J. Agronomy 19 (2003) 341 /356 353
factor Loadings in PCA1. Management of the first N split and weed infestation levels had a relatively minor effect on plant stand at PI in transplanted plots, but a very important effect in direct-seeded plots. Management of the second N application and weed infestation levels affected panicle density and the number of spikelets per panicle in both direct-seeded and transplanted plots, but had no effect on single rice grain weight and filled spikelets percentage. Wopereis-Pura et al. (2002) reported benefits from a third N splits in terms of yield and grain quality. None of the farmers in this study applied N in three splits.

Results indicate the importance of good crop management in general in irrigated systems in the Sahel. Yields that are realized in farmers' fields are still far from the potential that can be obtained with the rice cultivars that are being used. Kebbeh et al. (2002) demonstrated that information on improved and integrated crop management (ICM) is crucial to help farmers bridge this yield gap. Increasing fertilizer and herbicide use efficiencies will also reduce losses of N and herbicides to the environment.

Improved and ICM would increase the efficiency of inputs, such as N fertilizer and herbicide and seed quantity used. WARDA and partners have developed improved ICM options for irrigated rice cropping in the Sahel that are within farmers' means, based on farm surveys, and farmer participatory on- and off-station research (Wopereis et al., 2002). For the Senegal River Valley, these options have been summarized in a manual and posters (WARDA and SAED, 2001). These posters are based on RIDEV simulations and are specific to location, crop establishment technique, sowing date and cultivar choice, and can be adapted easily. The posters give a farming calendar with management options for a given site /sowing date /cultivar choice /crop establishment technique combination, and relevant information is given to enable farmers to adapt them according to their means.

However, ICM at the field level is also strongly dependent on the collective organization at the scheme level (Poussin, 1995, 1998; Le Gal and Papy, 1998). Sowing date, crop implantation method, herbicide and fertilizer quantities are not
decided individually and irrigation depends on water allocation rules. IRD and partners have, therefore, developed software that integrates the RIDEV simulation model at the scheme level (Poussin, 2000).

Acknowledgements .

We thank the farmers of the Podor region who contributed to this study. This study was partially financed by the European Development Fund.

Determinants of irrigated rice yield in the Senegal River valley .

Determinants of irrigated rice yield were studied in 45 rice fields in the Senegal River valley during 2 years in both wet and dry growing seasons. Grain yields were highly variable, ranging from 0 to 9.5 t ha , with an average yield over years and seasons of 5 t ha , indicating an average yield gap of about 4 /5 t ha 1 between actual farmers' yields and potential yields. Soil P and K status of farmers' fields were mostly above critical limits and pH and electrical conductivity values were in the optimal range for irrigated rice. Average yield levels for three out of the four seasons were not significantly different. However, cold temperatures at the onset of the dry season induced slower development rate and lower above-ground biomass despite higher plant and tiller density at panicle initiation (PI). Analysis of growth cycle and spikelet sterility levels in the sample fields using the RIDEV simulation model showed that yield losses due to cold or heat stress around flowering could be neglected. Yield variability was, therefore, assumed to be mostly due to differences in crop management (other than choice of sowing and harvest dates) at the farmer level. Plant density in the dry season was significantly higher than in the wet season in both transplanted and direct-seeded fields, with farmers compensating for retarded growth at the onset of the dry season due to cold temperatures. Low transplanting density and the use of relatively old seedlings seriously affected plant and tiller densities determined at PI. Principal component analyses conducted with three variables, i.e. plant density, tiller density and rice*/above-ground dry weight determined at PI and yield components at maturity allowed to determine the effect of crop management. Sub-optimal weed and N fertilizer management were major factors driving yield variability in farmers' fields. Increasing the productivity of irrigated rice will require collective action at both field and scheme level. # 2002 Elsevier Science B.V. all rights reserved.

Determinants of irrigated rice yield were studied in 45 rice fields in the Senegal River valley during 2 years in both wet and dry growing seasons. Grain yields were highly variable, ranging from 0 to 9.5 t ha 1, with an average yield over years and seasons of 5 t ha 1, indicating an average yield gap of about 4 /5 t ha 1 between actual farmers' yields and potential yields. Soil P and K status of farmers' fields were mostly above critical limits and pH and electrical conductivity values were in the optimal range for irrigated rice. Average yield levels for three out of the four seasons were not significantly different. However, cold temperatures at the onset of the dry season induced slower development rate and lower above-ground biomass despite higher plant and tiller density at panicle initiation (PI). Analysis of growth cycle and spikelet sterility levels in the sample fields using the RIDEV simulation model showed that yield losses due to cold or heat stress around flowering could be neglected. Yield variability was, therefore, assumed to be mostly due to differences in crop management (other than choice of sowing and harvest dates) at the farmer level. Plant density in the dry season was significantly higher than in the wet season in both transplanted and direct-seeded fields, with farmers compensating for retarded growth at the onset of the dry season due to cold temperatures. Low transplanting density and the use of relatively old seedlings seriously affected plant and tiller densities determined at PI. Principal component analyses conducted with three variables, i.e. plant density, tiller density and rice*/above-ground dry weight determined at PI and yield components at maturity allowed to determine the effect of crop management. Sub-optimal weed and N fertilizer management were major factors driving yield variability in farmers' fields. Increasing the productivity of irrigated rice will require collective action at both field and scheme level. # 2002 Elsevier Science B.V. all rights reserved.

Keywords: Irrigated rice; West Africa; soil fertility; weeds; modeling .

1. Introduction .

Senegal is one of the countries in West Africa that rely to a large extent on imports to face a growing demand for rice ( /600 000 t year 1). Domestic production covers only about 20% of this demand, of which most is produced in the * Corresponding author. Tel.: /33-467-14-9031; Fax: /33- 467-14-9068. E-mail address: Poussin@mpl.ird.fr (J.C. Poussin).
1161-0301/02/$ - See front matter # 2002 Elsevier Science B.V. all rights reserved. PII: S 1 1 6 1 - 0 3 0 1 ( 0 2 ) 0 0 0 7 8 - 3
Senegal River Valley, from a surface area that ranges from 25 000 to 35 000 ha Year 1. Until the
late 1980s, the local irrigation authority SAED (Societe Nationale d'Amenagement et d'Exploitation des terres du Delta et des vallees du fleuve
Senegal et de la Faleme) was responsible for the development of irrigation in Senegal. SAED
managed irrigation and drainage infrastructure,
land preparation, purchase of inputs, and bought paddy at subsidized prices (Le Gal and Dia, 1991).

In 1987, SAED withdrew from the rice production process. Since 1994, all rice irrigation schemes
have been privatized and most irrigation schemes
are now managed by farmer organizations.

Double cropping (growing rice in the wet and dry seasons on the same field) is possible, but
hardly practised in the Senegal River valley (Le
Gal and Papy, 1998). The potential grain yield that can be obtained ranges from 8 to 9 t ha 1 in the wet season (July sowing) and from 6 to 11 t ha 1
in the dry season (February sowing). Potential yields generally decline moving inland because of
heat stress at flowering (Dingkuhn and Sow,
1997). Farmers' yields are on average between 4 and 5 t ha 1, and, therefore, far below potential
yields. Crop management practices among farmers
are highly variable (Poussin, 1995, 1998), especially as far as weed and fertilizer management is
concerned (Diallo and Johnson, 1997; Wopereis et
al., 1999; Haefele et al., 2000).

Irrigation schemes in the Senegal River valley often need rehabilitation because of land leveling problems and poor condition of irrigation canals. Land preparation is mostly done under dry soil conditions, usually with a disk plow. The resulting seedbed is often uneven with large soil clods (Kante, 1996).

Farmers rarely buy certified seeds. Almost 50% of rice area is sown with seed retained from the previous harvest (Poussin, 1997; Belieres et al., 1997). In the Senegal River delta, the majority of the farmers direct seed rice rather than transplant the crop. Moving inland, transplanting becomes more and more important.

Weed infestation is one of the most important factors reducing rice yields in Senegal (SAED, 1997; Haefele et al., 2000). Yield losses of between 30 and 90% were observed in direct-seeded rice and up to 40% in transplanted rice (Diallo and Johnson, 1997). Haefele et al. (2000) demonstrated that benefits from improved weed control were in the order of 1 t ha 1 or almost 25% above farmers' practice. The most common herbicides are propanil and 2,4-D amine, mostly mixed before spraying. The dosage applied (average of 4.6 and 1.5 l ha 1, respectively; Belieres et al., 1997) are close to recommended doses (6 and 1 l ha 1, respectively). Farmers often delay herbicide application until weeds are impeding rice growth (Haefele et al., 2000), resulting in poor weed control.

J.C. Poussin et al. / Europ. J. Agronomy 19 (2003) 341 /356342
SAED recommends farmers to apply fertilizer in three splits. The first is a basal application of 100 kg ha 1 of diammonium-phosphate (DAP, containing 18% N and 20% P). The second consists of 100 kg urea (46% N) at the start of tillering for direct seeding, or after the transplanting shock in case of transplanting. The third application consists of 100 kg urea ha 1 at panicle initiation (PI), i.e. at about 1 month after the second split. In practice, farmers rarely apply fertilizers in three applications. Because of late arrival of fertilizers and because farmers want to avoid that weeds profit from basal fertilizer, DAP is often mixed with urea and applied at the start of tillering (Wopereis et al., 1999). Fertilizer use is generally profitable in Sahelian West Africa (Donovan et al., 1999). Soil salinity is very pronounced in the delta of the Senegal River, but salinity levels decrease moving inland (Wopereis et al., 1998).

The objective of this paper is to shed more light on the importance of soil and weather variability and crop management on yield formation in farmers' fields under irrigation in the Senegal River valley.

2. Materials and methods .

2.1. Site description and surveys
The surveys were conducted in the region of Podor (16840?N, 158W), situated in the Senegal River middle valley, about 200 km east of the mouth of the Senegal River (see map in Fig. 1). Irrigation schemes in the Senegal River valley have been mostly installed on heavy clay (i.e. arid Vertisol, Soil Survey Staff, 1981), locally known as Hollalde or Faux-Hollalde. The first rice crop is sown during the hot dry season (mostly in February) and the second crop during the wet season (mostly in July). Late sowing in the wet season results in a risk of spikelet sterility due to cold in November (Dingkuhn et al., 1995a,b). Air temperatures in February to March are relatively low, slowing down crop development in the dry season. From May to June, hot and dry winds around flowering may cause spikelet sterility (Dingkuhn et al., 1995a,b). Rice fields are flooded
for 100 /120 days during each growth cycle. Irrigation water from the Senegal River is supplied to the field by floating pumps. The potential yield level that can be obtained in Podor with July sowing in the wet season and February sowing in the dry season is about 8 /9 t ha 1 (Dingkuhn and Sow, 1997).

Our sample included 45 rice fields cultivated by 11 farmers in 11 irrigation schemes in the Podor region. The survey included 9 fields in the 1994 dry season, 17 fields in the 1994 wet season, 6 fields in the 1995 dry season and 13 fields in the 1995 wet season. Farmers used four indica cultivars: Aiwu (short duration, slender grain), I Kong Pao (short duration, bold grain) and IR1529 and Jaya (medium duration, slender grain). Out of the 45 fields, 27 were transplanted and 18 direct-seeded. Each farmer cultivated various fields in the area in different irrigation schemes and used sometimes more than one crop establishment method. One to four (the exact number depending on field size) 16 m2 micro-plots were installed in each farmer field, yielding 18 micro-plots in the 1994 dry season, 38 in the 1994 wet season, 14 in the 1995 dry season and 28 in the 1995 wet season. On this total of 98 micro-plots, 4 micro-plots in the 1994 dry season, 6 in the 1995 dry season and 1 in the 1995 wet season had no panicles at all at maturity, leaving a total of 87 plots with harvested yield.

2.2. Soil analyses .

The topsoil (0 /0.2 m depth) from all fields was sampled before the onset of the growing season (one composite sample from 5 samples taken at random per field). Soil analyses (P-Olsen, pH, electrical conductivity, CEC and exchangeable K) were conducted in the IRD laboratory in Dakar, Senegal following standard methodologies.

2.3. Fertilizer and weed management practices .

Weed management (mode, dosage, timing and type of herbicide used if any) was monitored for each field. Visual scores of weed infestation were taken at PI and maturity. Three classes of surface area coverage by weeds were distinguished: less than 10%; between 10 and 30%; and more than
J.C. Poussin et al. / Europ. J. Agronomy 19 (2003) 341 /356 343
30%. These visual estimates were calibrated by estimating oven-dry weight (2 days, 70 8C) of above-ground weed biomass in 25 micro-plots, taking four 0.32 m2 samples per micro-plot, using 0.64 m diameter rings.

Fertilizer management (timing and dosage of fertilizer application) was also monitored. Data obtained for each fertilizer application and farmer were grouped into five classes:
i) timely application, sufficient dosage ( /50
kg N ha 1); ii) timely application, insufficient dosage (B/50
kg N ha 1);
iii) late application, sufficient dosage ( /50
kg N ha 1);
iv) late application, insufficient dosage (B/50
kg N ha 1); and
v) no N application.
2.4. Crop establishment, development and yield components
Four 0.32 m2 samples were taken at PI and maturity using 0.64 m diameter rings placed at random in each micro-plot. At PI, the canopy structure was determinated from the number of plants, number of tillers, and oven-dry weight (2 days at 70 8C) of above-ground rice biomass per unit area. At maturity, rice grain yield (corrected for 14% moisture) and yield components were determined. Yield components included panicle number, spikelet number, straw weight (oven-dry weight of rice green and dead biomass) per unit area, and filled spikelet percentage, and the average weight of one single rice grain (in mg, corrected for 14% moisture) determined from 1000 grains.

2.5. Crop modeling .

The RIDEV model (Dingkuhn et al., 1995b; Dingkuhn, 1997) was used to determine best periods for rice cropping in both growing seasons. The model uses daily minimum and maximum air temperatures, sowing date, variety-specific photothermal constants and crop establishment method as inputs. Outputs are growth duration and
spikelet sterility due to cold stress (mainly in the wet season, but cold may also affect early sowing in the dry season) and heat stress (exclusively during the dry season). Simulations were conducted year-round, using 14 years of weather data from the Podor region for direct-seeded I Kong Pao, a short-duration rice cultivar widely grown in the region in 1994 and 1995. Spikelet sterility percentages were also determined for actual farmer sowing dates and varietal choice using 1994 and 1995 weather data from Podor to investigate if in some cases heat or cold stress affected farmer yields.

2.6. Statistical analyses .

Data analysis first allowed to estimate the effect of year, season and cultivar on yield formation. We subsequently removed these effects through data transformation to analyze the effect of crop management (weeding and N fertilization), regardless of season, year or cultivar.

